[
    {
        "name": "osu!",
        "description": "The official osu! client",
        "owner": "ppy",
        "repo": "osu",
        "files": {
            "macOS": {
                "asset_name": "osu.app.Apple.Silicon.zip",
                "internal_name": "osu!.app/Contents/MacOS/osu.Game.dll"
            },
            "Windows": {
                "asset_name": "install.exe",
                "internal_name": "lib/app/osu.Game.dll",
                "type": "exe"
            },
            "Linux": {
                "asset_name": "osu.AppImage",
                "internal_name": "usr/bin/osu.Game.dll",
                "type": "appimage"
            }
        },
        "count": 5
    },
    {
        "name": "g0v0!",
        "description": "g0v0! -- free and open rhythm experience! (a community project based on osu!lazer codebase)",
        "owner": "GooGuTeam",
        "repo": "g0v0",
        "files": {
            "Windows": {
                "asset_name": "g0v0-win-Portable.zip",
                "internal_name": "current/osu.Game.dll"
            },
            "macOS": {
                "asset_name": "g0v0.app.Intel.zip",
                "internal_name": "g0v0!.app/Contents/MacOS/osu.Game.dll"
            },
            "Linux": {
                "asset_name": "g0v0.AppImage",
                "internal_name": "usr/bin/osu.Game.dll",
                "type": "appimage"
            }
        },
        "count": 5
    }
]
